{"completed_at":"2027-08-02T10:00:02.000000Z","contract_version":"opencare-execution-receipt/1","envelope_id":"sha256:b78f8b1f5e18324bbb5d26bf2674b622506be4beef19205836ef11b857b4fce5","external":null,"model_id":null,"output_sha256":"561c03f56ace489bb56fec63df72ebb01e73641954fdceae941253b0c99b6c65","provider_id":null,"provider_kind":null,"reason_codes":[],"receipt_id":"sha256:8cf5f2c3b4735631638c2765e7cfced528df08dd475147c17eb6e40fe0d0bd65","receipt_sha256":"9b9b2a17fd37ac93b687c1ecfbe410564fd76ebeffc48b6bb316ed9f609524ab","started_at":"2027-08-02T10:00:01.000000Z","status":"completed","used_evidence_ids":["evidence-medication-alice"],"used_tools":["context.read"]}
