{"completed_at":"2027-08-02T10:00:02.000000Z","contract_version":"opencare-execution-receipt/1","envelope_id":"sha256:b78f8b1f5e18324bbb5d26bf2674b622506be4beef19205836ef11b857b4fce5","external":null,"model_id":null,"output_sha256":null,"provider_id":null,"provider_kind":null,"reason_codes":["safety_refused"],"receipt_id":"sha256:89fb5e31968570991f2e13f589e0b2e2269368afb40898dbe639d56699f0c0d0","receipt_sha256":"082be58f473820f8410f9a34188b9a8d2a286462d9d4740f37826d2dd4d036aa","started_at":"2027-08-02T10:00:01.000000Z","status":"refused","used_evidence_ids":["evidence-medication-alice"],"used_tools":["context.read"]}
