{"completed_at":"2027-08-02T10:00:01.000000Z","contract_version":"opencare-execution-receipt/1","envelope_id":"sha256:0000000000000000000000000000000000000000000000000000000000000000","external":null,"model_id":null,"output_sha256":null,"provider_id":null,"provider_kind":null,"reason_codes":["unsupported_action"],"receipt_id":"sha256:5081a6093790ccdfed14f3699e8ec66ac8bb8b2f231d2a31ffb903c4ab7f336d","receipt_sha256":"13f005ee788cc69261a4d91c402324c5ec293e231ff68b6fe86109ec44686d7a","started_at":"2027-08-02T10:00:00.000000Z","status":"refused","used_evidence_ids":[],"used_tools":[]}
