{"completed_at":"2027-08-02T10:00:02.000000Z","contract_version":"opencare-execution-receipt/1","envelope_id":"sha256:449b62765be9aa036ec095c5e37ec6374a6d1aca285f59d1b0a0fe345573f6da","external":null,"model_id":null,"output_sha256":"561c03f56ace489bb56fec63df72ebb01e73641954fdceae941253b0c99b6c65","provider_id":null,"provider_kind":null,"reason_codes":[],"receipt_id":"sha256:2e917689b66d373b184709fecbc383cf948b7d90121bb373272d9beb3088f078","receipt_sha256":"92e5de4f2f2a7a7aca790af4e35ad1f30b18ac55f962255817727e4381756800","started_at":"2027-08-02T10:00:01.000000Z","status":"completed","used_evidence_ids":["evidence-medication-alice"],"used_tools":["context.read"]}
